{
  "content_hash": "sha256:3e705af2c00a2407f0cfc9efa2f355028845c9d907374fc208c5569a90ba1198",
  "corrections": [],
  "data": {
    "coverage_status": "active",
    "data_delay_warning": "Uses delayed/reference indicators and outbound source links only; no brokerage connection or trade execution.",
    "disclaimer": "Research only. Not personalized financial advice. Do not treat this as a buy, sell, or allocation recommendation.",
    "evidence_count": 2,
    "external_tracker_url": "https://www.nextgig.rocks/dash/ai-tracker/",
    "freshness_timestamp": "2026-07-01T12:08:56Z",
    "key": "ai-infra-capex",
    "last_observed_at": "2026-07-01T12:08:56Z",
    "methodology": "Rows are rendered only from source-linked metrics, official pages, or recent news snapshots. Missing structured data is shown as an explicit coverage gap.",
    "name": "AI Infrastructure Capex",
    "primary_source_url": "https://www.bis.gov/",
    "risk_summary": "AI capex can reverse if source data lags, power constraints intensify, or hyperscaler spending guidance weakens.",
    "thesis": "Tracks data-center, accelerator, memory, power, and cloud capex channels using source-linked public facts.",
    "tracker_sections": [
      {
        "coverage_status": "active",
        "evidence_count": 2,
        "key": "ai-infra-evidence",
        "last_observed_at": "2026-07-01T12:08:56Z",
        "metric_rows": [
          {
            "as_of_date": "2026-07-01T12:08:56Z",
            "coverage_status": "active",
            "detail": "Counts recent semiconductor, AI infrastructure, and tracked-ticker news rows already admitted into snapshots.",
            "freshness": "fresh",
            "key": "accelerator-news",
            "label": "Accelerator and memory evidence",
            "source": "Stonks Radar news snapshots",
            "source_url": "https://www.bis.gov/",
            "value": "1 recent source-linked items"
          }
        ],
        "news_events": [
          {
            "breaking_score": 76,
            "claim_level": "clustered_candidate",
            "confidence": 0.78,
            "event_type": "trade_policy",
            "evidence_match_status": "matched",
            "first_seen_at": "2026-06-29T12:08:56Z",
            "freshness": "fresh",
            "id": "semiconductor_export_controls_seed",
            "item_kind": "official_update",
            "last_seen_at": "2026-07-01T12:08:56Z",
            "market_direction": "mixed",
            "published_at": "2026-07-01T12:08:56Z",
            "regions": [
              {
                "confidence": 0.92,
                "key": "CHN",
                "name": "China",
                "relation": "event_region"
              },
              {
                "confidence": 0.86,
                "key": "USA",
                "name": "United States",
                "relation": "affected_region"
              },
              {
                "confidence": 0.84,
                "key": "KOR",
                "name": "South Korea",
                "relation": "affected_region"
              },
              {
                "confidence": 0.78,
                "key": "JPN",
                "name": "Japan",
                "relation": "affected_region"
              },
              {
                "confidence": 0.72,
                "key": "EU",
                "name": "European Union",
                "relation": "affected_region"
              },
              {
                "confidence": 0.76,
                "key": "USA",
                "name": "United States",
                "relation": "market_region"
              },
              {
                "confidence": 0.74,
                "key": "KOR",
                "name": "South Korea",
                "relation": "market_region"
              }
            ],
            "severity": "high",
            "source_count": 3,
            "source_links": [
              {
                "is_primary": true,
                "label": "BIS",
                "policy_version": 1,
                "published_at": "2026-06-30T18:08:56Z",
                "source_key": "bis",
                "title": "Bureau of Industry and Security export controls",
                "trust_tier": "T0_OFFICIAL",
                "url": "https://www.bis.gov/"
              },
              {
                "is_primary": false,
                "label": "SEC EDGAR",
                "policy_version": 1,
                "published_at": "2026-06-30T18:08:56Z",
                "source_key": "sec_edgar",
                "title": "Issuer filings for affected companies",
                "trust_tier": "T1_REGULATED_FILING",
                "url": "https://www.sec.gov/edgar/search/"
              },
              {
                "is_primary": false,
                "label": "Source policy",
                "policy_version": 1,
                "published_at": "2026-06-30T18:08:56Z",
                "source_key": "source_policy",
                "title": "Export Administration Regulations reference",
                "trust_tier": "T3_REVIEWED_PUBLIC_SOURCE",
                "url": "https://www.bis.gov/regulations/ear/table-of-contents"
              }
            ],
            "summary": "Official-policy monitoring links export controls to NVIDIA, Samsung Electronics, Japan equipment suppliers, and EU tooling exposure.",
            "tickers": [
              {
                "confidence": 0.88,
                "exchange": "NASDAQ",
                "name": "NVIDIA Corporation",
                "relationship": "affected_company",
                "symbol": "NVDA"
              },
              {
                "confidence": 0.84,
                "exchange": "KRX",
                "name": "Samsung Electronics Co., Ltd.",
                "relationship": "affected_company",
                "symbol": "005930.KS"
              }
            ],
            "title": "China-origin export-control risk remains elevated for AI-chip supply chains",
            "topics": [
              {
                "confidence": 0.94,
                "key": "semiconductors",
                "label": "Semiconductors"
              },
              {
                "confidence": 0.79,
                "key": "geopolitics",
                "label": "Geopolitics"
              },
              {
                "confidence": 0.86,
                "key": "trade_policy",
                "label": "Trade policy"
              },
              {
                "confidence": 0.77,
                "key": "supply_chain",
                "label": "Supply chain"
              }
            ],
            "trust_score": 88
          }
        ],
        "source_links": [
          {
            "label": "NextGig",
            "policy_version": 1,
            "source_key": "nextgig",
            "url": "https://www.nextgig.rocks/dash/ai-tracker/"
          },
          {
            "label": "BIS",
            "policy_version": 1,
            "source_key": "bis",
            "url": "https://www.bis.gov/"
          }
        ],
        "summary": "Hyperscaler capex, accelerator supply, memory/HBM, and data-center power are shown only through source-linked rows.",
        "title": "AI infrastructure evidence"
      }
    ]
  },
  "generated_at": "2026-07-03T16:29:14.926431Z",
  "hard_expires_at": "2026-07-10T16:29:14.926431Z",
  "locale": "en",
  "object_key": "ai-infra-capex",
  "object_type": "scenario_basket",
  "schema_version": "1.0",
  "snapshot_version": 6,
  "source_policy_versions": [
    {
      "policy_version": 1,
      "source_key": "federal_reserve"
    },
    {
      "policy_version": 1,
      "source_key": "sec_edgar"
    },
    {
      "policy_version": 1,
      "source_key": "eia"
    },
    {
      "policy_version": 1,
      "source_key": "world_bank"
    },
    {
      "policy_version": 1,
      "source_key": "gdelt"
    },
    {
      "policy_version": 1,
      "source_key": "google_news_rss"
    },
    {
      "policy_version": 1,
      "source_key": "yahoo_finance_rss"
    },
    {
      "policy_version": 1,
      "source_key": "yahoo_finance_delayed_quote"
    },
    {
      "policy_version": 1,
      "source_key": "stooq_delayed_quote"
    },
    {
      "policy_version": 1,
      "source_key": "treasury_xml_feed"
    },
    {
      "policy_version": 1,
      "source_key": "krx_open_api"
    },
    {
      "policy_version": 1,
      "source_key": "data_go_kr"
    },
    {
      "policy_version": 1,
      "source_key": "japan_mof_jgb_csv"
    },
    {
      "policy_version": 1,
      "source_key": "bis"
    },
    {
      "policy_version": 1,
      "source_key": "who"
    },
    {
      "policy_version": 1,
      "source_key": "cdc"
    },
    {
      "policy_version": 1,
      "source_key": "company_ir"
    },
    {
      "policy_version": 1,
      "source_key": "ecb"
    },
    {
      "policy_version": 1,
      "source_key": "bank_of_korea"
    },
    {
      "policy_version": 1,
      "source_key": "bank_of_japan"
    },
    {
      "policy_version": 1,
      "source_key": "bcb"
    },
    {
      "policy_version": 1,
      "source_key": "rocket_lab_ir"
    },
    {
      "policy_version": 1,
      "source_key": "ionq_ir"
    },
    {
      "policy_version": 1,
      "source_key": "iea"
    },
    {
      "policy_version": 1,
      "source_key": "source_policy"
    }
  ],
  "stale_after": "2026-07-04T04:29:14.926431Z",
  "warnings": [
    {
      "code": "reference_delayed_market_data",
      "message": "Market indicators are delayed/reference unless licensed.",
      "severity": "info"
    }
  ]
}
