{
  "content_hash": "sha256:ef853c32b1ebaf2538ad06c7c1fcfa88f54f3dd8fbea8f0b4dd124012446cc0d",
  "corrections": [],
  "data": {
    "coverage_window": "7d",
    "events": [],
    "generated_label": "2026-07-01T12:08:56Z",
    "key": "AUS",
    "name": "호주",
    "regional_brief": "호주 관련 출처 연결 뉴스 이벤트 0건이 있으며 발생지, 영향 지역, 시장 지역 라벨을 분리합니다."
  },
  "generated_at": "2026-07-03T16:29:14.926431Z",
  "hard_expires_at": "2026-07-10T16:29:14.926431Z",
  "locale": "ko",
  "object_key": "news_region_AUS",
  "object_type": "news_region",
  "schema_version": "1.0",
  "snapshot_version": 6,
  "source_policy_versions": [
    {
      "policy_version": 1,
      "source_key": "federal_reserve"
    },
    {
      "policy_version": 1,
      "source_key": "sec_edgar"
    },
    {
      "policy_version": 1,
      "source_key": "eia"
    },
    {
      "policy_version": 1,
      "source_key": "world_bank"
    },
    {
      "policy_version": 1,
      "source_key": "gdelt"
    },
    {
      "policy_version": 1,
      "source_key": "google_news_rss"
    },
    {
      "policy_version": 1,
      "source_key": "yahoo_finance_rss"
    },
    {
      "policy_version": 1,
      "source_key": "yahoo_finance_delayed_quote"
    },
    {
      "policy_version": 1,
      "source_key": "stooq_delayed_quote"
    },
    {
      "policy_version": 1,
      "source_key": "treasury_xml_feed"
    },
    {
      "policy_version": 1,
      "source_key": "krx_open_api"
    },
    {
      "policy_version": 1,
      "source_key": "data_go_kr"
    },
    {
      "policy_version": 1,
      "source_key": "japan_mof_jgb_csv"
    },
    {
      "policy_version": 1,
      "source_key": "bis"
    },
    {
      "policy_version": 1,
      "source_key": "who"
    },
    {
      "policy_version": 1,
      "source_key": "cdc"
    },
    {
      "policy_version": 1,
      "source_key": "company_ir"
    },
    {
      "policy_version": 1,
      "source_key": "ecb"
    },
    {
      "policy_version": 1,
      "source_key": "bank_of_korea"
    },
    {
      "policy_version": 1,
      "source_key": "bank_of_japan"
    },
    {
      "policy_version": 1,
      "source_key": "bcb"
    },
    {
      "policy_version": 1,
      "source_key": "rocket_lab_ir"
    },
    {
      "policy_version": 1,
      "source_key": "ionq_ir"
    },
    {
      "policy_version": 1,
      "source_key": "iea"
    },
    {
      "policy_version": 1,
      "source_key": "source_policy"
    }
  ],
  "stale_after": "2026-07-04T04:29:14.926431Z",
  "warnings": [
    {
      "code": "reference_delayed_market_data",
      "message": "시장 지표는 라이선스가 없는 한 지연/참조 데이터입니다.",
      "severity": "info"
    }
  ]
}
