{
  "content_hash": "sha256:df05139c4b3b8beecb629185a48c152f13373479fb35020476dce0672265a6fe",
  "corrections": [],
  "data": {
    "coverage_window": "7d",
    "events": [],
    "generated_label": "2026-07-01T12:08:56Z",
    "key": "GBR",
    "name": "United Kingdom",
    "regional_brief": "United Kingdom has 0 source-linked news event(s), with relation labels separating event location, affected region, and market region."
  },
  "generated_at": "2026-07-03T11:31:55.000229Z",
  "hard_expires_at": "2026-07-10T11:31:55.000229Z",
  "locale": "en",
  "object_key": "news_region_GBR",
  "object_type": "news_region",
  "schema_version": "1.0",
  "snapshot_version": 5,
  "source_policy_versions": [
    {
      "policy_version": 1,
      "source_key": "federal_reserve"
    },
    {
      "policy_version": 1,
      "source_key": "sec_edgar"
    },
    {
      "policy_version": 1,
      "source_key": "eia"
    },
    {
      "policy_version": 1,
      "source_key": "world_bank"
    },
    {
      "policy_version": 1,
      "source_key": "gdelt"
    },
    {
      "policy_version": 1,
      "source_key": "google_news_rss"
    },
    {
      "policy_version": 1,
      "source_key": "yahoo_finance_rss"
    },
    {
      "policy_version": 1,
      "source_key": "yahoo_finance_delayed_quote"
    },
    {
      "policy_version": 1,
      "source_key": "stooq_delayed_quote"
    },
    {
      "policy_version": 1,
      "source_key": "treasury_xml_feed"
    },
    {
      "policy_version": 1,
      "source_key": "krx_open_api"
    },
    {
      "policy_version": 1,
      "source_key": "data_go_kr"
    },
    {
      "policy_version": 1,
      "source_key": "japan_mof_jgb_csv"
    },
    {
      "policy_version": 1,
      "source_key": "bis"
    },
    {
      "policy_version": 1,
      "source_key": "who"
    },
    {
      "policy_version": 1,
      "source_key": "cdc"
    },
    {
      "policy_version": 1,
      "source_key": "company_ir"
    },
    {
      "policy_version": 1,
      "source_key": "ecb"
    },
    {
      "policy_version": 1,
      "source_key": "bank_of_korea"
    },
    {
      "policy_version": 1,
      "source_key": "bank_of_japan"
    },
    {
      "policy_version": 1,
      "source_key": "bcb"
    },
    {
      "policy_version": 1,
      "source_key": "rocket_lab_ir"
    },
    {
      "policy_version": 1,
      "source_key": "ionq_ir"
    },
    {
      "policy_version": 1,
      "source_key": "iea"
    },
    {
      "policy_version": 1,
      "source_key": "source_policy"
    }
  ],
  "stale_after": "2026-07-03T23:31:55.000229Z",
  "warnings": [
    {
      "code": "reference_delayed_market_data",
      "message": "Market indicators are delayed/reference unless licensed.",
      "severity": "info"
    }
  ]
}
