{
  "content_hash": "sha256:4feb54717c3caf27c57e4fec601bed8a037ac6f9330ff25d1670f7d0c6f5a50d",
  "corrections": [],
  "data": {
    "coverage_window": "7d",
    "events": [],
    "generated_label": "2026-07-01T12:08:56Z",
    "name": "Quantinuum",
    "summary": "No approved news events are currently linked to QUANTINUUM.",
    "symbol": "QUANTINUUM"
  },
  "generated_at": "2026-07-03T16:29:14.926431Z",
  "hard_expires_at": "2026-07-10T16:29:14.926431Z",
  "locale": "en",
  "object_key": "news_ticker_QUANTINUUM",
  "object_type": "news_ticker",
  "schema_version": "1.0",
  "snapshot_version": 6,
  "source_policy_versions": [
    {
      "policy_version": 1,
      "source_key": "federal_reserve"
    },
    {
      "policy_version": 1,
      "source_key": "sec_edgar"
    },
    {
      "policy_version": 1,
      "source_key": "eia"
    },
    {
      "policy_version": 1,
      "source_key": "world_bank"
    },
    {
      "policy_version": 1,
      "source_key": "gdelt"
    },
    {
      "policy_version": 1,
      "source_key": "google_news_rss"
    },
    {
      "policy_version": 1,
      "source_key": "yahoo_finance_rss"
    },
    {
      "policy_version": 1,
      "source_key": "yahoo_finance_delayed_quote"
    },
    {
      "policy_version": 1,
      "source_key": "stooq_delayed_quote"
    },
    {
      "policy_version": 1,
      "source_key": "treasury_xml_feed"
    },
    {
      "policy_version": 1,
      "source_key": "krx_open_api"
    },
    {
      "policy_version": 1,
      "source_key": "data_go_kr"
    },
    {
      "policy_version": 1,
      "source_key": "japan_mof_jgb_csv"
    },
    {
      "policy_version": 1,
      "source_key": "bis"
    },
    {
      "policy_version": 1,
      "source_key": "who"
    },
    {
      "policy_version": 1,
      "source_key": "cdc"
    },
    {
      "policy_version": 1,
      "source_key": "company_ir"
    },
    {
      "policy_version": 1,
      "source_key": "ecb"
    },
    {
      "policy_version": 1,
      "source_key": "bank_of_korea"
    },
    {
      "policy_version": 1,
      "source_key": "bank_of_japan"
    },
    {
      "policy_version": 1,
      "source_key": "bcb"
    },
    {
      "policy_version": 1,
      "source_key": "rocket_lab_ir"
    },
    {
      "policy_version": 1,
      "source_key": "ionq_ir"
    },
    {
      "policy_version": 1,
      "source_key": "iea"
    },
    {
      "policy_version": 1,
      "source_key": "source_policy"
    }
  ],
  "stale_after": "2026-07-04T04:29:14.926431Z",
  "warnings": [
    {
      "code": "reference_delayed_market_data",
      "message": "Market indicators are delayed/reference unless licensed.",
      "severity": "info"
    }
  ]
}
