{
  "schema_version": "1.0",
  "snapshot_version": 1,
  "locale": "ko",
  "generated_at": "2026-06-29T05:27:58Z",
  "stale_after": "2026-06-29T17:27:58Z",
  "hard_expires_at": "2026-07-06T05:27:58Z",
  "object_type": "news_ticker",
  "object_key": "news_ticker_QUANTINUUM",
  "content_hash": "sha256:a409e8e212f2b35e9e0905f59aa2bedcd603a905f74b655f7f5a8c39e43cbbfb",
  "source_policy_versions": [
    {
      "source_key": "federal_reserve",
      "policy_version": 1
    },
    {
      "source_key": "sec_edgar",
      "policy_version": 1
    },
    {
      "source_key": "eia",
      "policy_version": 1
    },
    {
      "source_key": "world_bank",
      "policy_version": 1
    },
    {
      "source_key": "gdelt",
      "policy_version": 1
    },
    {
      "source_key": "google_news_rss",
      "policy_version": 1
    },
    {
      "source_key": "yahoo_finance_rss",
      "policy_version": 1
    },
    {
      "source_key": "yahoo_finance_delayed_quote",
      "policy_version": 1
    },
    {
      "source_key": "stooq_delayed_quote",
      "policy_version": 1
    },
    {
      "source_key": "treasury_xml_feed",
      "policy_version": 1
    },
    {
      "source_key": "krx_open_api",
      "policy_version": 1
    },
    {
      "source_key": "data_go_kr",
      "policy_version": 1
    },
    {
      "source_key": "japan_mof_jgb_csv",
      "policy_version": 1
    },
    {
      "source_key": "bis",
      "policy_version": 1
    },
    {
      "source_key": "who",
      "policy_version": 1
    },
    {
      "source_key": "cdc",
      "policy_version": 1
    },
    {
      "source_key": "company_ir",
      "policy_version": 1
    },
    {
      "source_key": "ecb",
      "policy_version": 1
    },
    {
      "source_key": "bank_of_korea",
      "policy_version": 1
    },
    {
      "source_key": "bank_of_japan",
      "policy_version": 1
    },
    {
      "source_key": "bcb",
      "policy_version": 1
    },
    {
      "source_key": "rocket_lab_ir",
      "policy_version": 1
    },
    {
      "source_key": "ionq_ir",
      "policy_version": 1
    },
    {
      "source_key": "iea",
      "policy_version": 1
    },
    {
      "source_key": "source_policy",
      "policy_version": 1
    }
  ],
  "data": {
    "symbol": "QUANTINUUM",
    "name": "퀀티넘",
    "generated_label": "2026-06-29T05:27:58Z",
    "summary": "QUANTINUUM에 연결된 승인 뉴스 이벤트가 아직 없습니다.",
    "events": []
  },
  "warnings": [
    {
      "code": "reference_delayed_market_data",
      "message": "시장 지표는 라이선스가 없는 한 지연/참조 데이터입니다.",
      "severity": "info"
    }
  ],
  "corrections": []
}
