{
  "schema_version": "1.0",
  "snapshot_version": 1,
  "locale": "en",
  "generated_at": "2026-07-01T12:08:56Z",
  "stale_after": "2026-07-02T00:08:56Z",
  "hard_expires_at": "2026-07-08T12:08:56Z",
  "object_type": "correction_log",
  "object_key": "corrections",
  "content_hash": "sha256:e3eb12da99e044ecc7d50cea407bf17f33c546e5309aa7ee661234baed2b7750",
  "source_policy_versions": [
    {
      "source_key": "federal_reserve",
      "policy_version": 1
    },
    {
      "source_key": "sec_edgar",
      "policy_version": 1
    },
    {
      "source_key": "eia",
      "policy_version": 1
    },
    {
      "source_key": "world_bank",
      "policy_version": 1
    },
    {
      "source_key": "gdelt",
      "policy_version": 1
    },
    {
      "source_key": "google_news_rss",
      "policy_version": 1
    },
    {
      "source_key": "yahoo_finance_rss",
      "policy_version": 1
    },
    {
      "source_key": "yahoo_finance_delayed_quote",
      "policy_version": 1
    },
    {
      "source_key": "stooq_delayed_quote",
      "policy_version": 1
    },
    {
      "source_key": "treasury_xml_feed",
      "policy_version": 1
    },
    {
      "source_key": "krx_open_api",
      "policy_version": 1
    },
    {
      "source_key": "data_go_kr",
      "policy_version": 1
    },
    {
      "source_key": "japan_mof_jgb_csv",
      "policy_version": 1
    },
    {
      "source_key": "bis",
      "policy_version": 1
    },
    {
      "source_key": "who",
      "policy_version": 1
    },
    {
      "source_key": "cdc",
      "policy_version": 1
    },
    {
      "source_key": "company_ir",
      "policy_version": 1
    },
    {
      "source_key": "ecb",
      "policy_version": 1
    },
    {
      "source_key": "bank_of_korea",
      "policy_version": 1
    },
    {
      "source_key": "bank_of_japan",
      "policy_version": 1
    },
    {
      "source_key": "bcb",
      "policy_version": 1
    },
    {
      "source_key": "rocket_lab_ir",
      "policy_version": 1
    },
    {
      "source_key": "ionq_ir",
      "policy_version": 1
    },
    {
      "source_key": "iea",
      "policy_version": 1
    },
    {
      "source_key": "source_policy",
      "policy_version": 1
    }
  ],
  "data": {
    "entries": []
  },
  "warnings": [
    {
      "code": "reference_delayed_market_data",
      "message": "Market indicators are delayed/reference unless licensed.",
      "severity": "info"
    }
  ],
  "corrections": []
}
