{
  "schema_version": "1.0",
  "snapshot_version": 1,
  "locale": "ko",
  "generated_at": "2026-06-30T13:19:11Z",
  "stale_after": "2026-07-01T01:19:11Z",
  "hard_expires_at": "2026-07-07T13:19:11Z",
  "object_type": "news_region",
  "object_key": "news_region_THA",
  "content_hash": "sha256:ae4304258e9725448aadb833fd99ee2045fd7ded434e5ee11193c3846a8ab9fd",
  "source_policy_versions": [
    {
      "source_key": "federal_reserve",
      "policy_version": 1
    },
    {
      "source_key": "sec_edgar",
      "policy_version": 1
    },
    {
      "source_key": "eia",
      "policy_version": 1
    },
    {
      "source_key": "world_bank",
      "policy_version": 1
    },
    {
      "source_key": "gdelt",
      "policy_version": 1
    },
    {
      "source_key": "google_news_rss",
      "policy_version": 1
    },
    {
      "source_key": "yahoo_finance_rss",
      "policy_version": 1
    },
    {
      "source_key": "yahoo_finance_delayed_quote",
      "policy_version": 1
    },
    {
      "source_key": "stooq_delayed_quote",
      "policy_version": 1
    },
    {
      "source_key": "treasury_xml_feed",
      "policy_version": 1
    },
    {
      "source_key": "krx_open_api",
      "policy_version": 1
    },
    {
      "source_key": "data_go_kr",
      "policy_version": 1
    },
    {
      "source_key": "japan_mof_jgb_csv",
      "policy_version": 1
    },
    {
      "source_key": "bis",
      "policy_version": 1
    },
    {
      "source_key": "who",
      "policy_version": 1
    },
    {
      "source_key": "cdc",
      "policy_version": 1
    },
    {
      "source_key": "company_ir",
      "policy_version": 1
    },
    {
      "source_key": "ecb",
      "policy_version": 1
    },
    {
      "source_key": "bank_of_korea",
      "policy_version": 1
    },
    {
      "source_key": "bank_of_japan",
      "policy_version": 1
    },
    {
      "source_key": "bcb",
      "policy_version": 1
    },
    {
      "source_key": "rocket_lab_ir",
      "policy_version": 1
    },
    {
      "source_key": "ionq_ir",
      "policy_version": 1
    },
    {
      "source_key": "iea",
      "policy_version": 1
    },
    {
      "source_key": "source_policy",
      "policy_version": 1
    }
  ],
  "data": {
    "key": "THA",
    "name": "태국",
    "generated_label": "2026-06-30T13:19:11Z",
    "regional_brief": "태국 관련 출처 연결 뉴스 이벤트 0건이 있으며 발생지, 영향 지역, 시장 지역 라벨을 분리합니다.",
    "events": []
  },
  "warnings": [
    {
      "code": "reference_delayed_market_data",
      "message": "시장 지표는 라이선스가 없는 한 지연/참조 데이터입니다.",
      "severity": "info"
    }
  ],
  "corrections": []
}
